content,product,,,,,,,,,,,,,,,,,,,,,,,,,,,,,,,,,,,,,,,,,,,,,,,,,,,,,,,,,,,,,,,,,
"Today, I tackled restringing a day/night shade (4 cord version with two springs) and the operation was a success. So, I just ordered more cord as I have a couple more to do. And, I installed some LED bulbs (50 watt equivalent) in the lighting fixtures in the living/dinette area.
https://www.amazon.com/gp/product/B0...?ie=UTF8&psc=1
The fixtures have room for two bulbs per fixture, but only one of these bulbs will fit in each fixture, so I think the overall brightness will be equivalent to 70 watts, and we really needed more light than the 40 watts equivalent per fixture that came in the motorhome when we bought it.",Lights,,,,,,,,,,,,,,,,,,,,,,,,,,,,,,,,,,,,,,,,,,,,,,,,,,,,,,,,,,,,,,,,,
Tightened down the leaking input lines to the HW heater. I'm guessing they managed to work loose over the last 18 months as they just started to leak. Got a good 1/2 -> 3/4 turn on each and the leaks have stopped.,Heating and Cooling,,,,,,,,,,,,,,,,,,,,,,,,,,,,,,,,,,,,,,,,,,,,,,,,,,,,,,,,,,,,,,,,,
"We replaced the awning fabric
today. About 3 hours and 3 people. Not to bad to do. This is the second time in 4 years we had to replace the fabric. The original lasted 13 years. The fabric we used to replace that only lasted 4 years. Never use Sun Wave fabric. This time we used Dometic replacement fabric.",Exterior,,,,,,,,,,,,,,,,,,,,,,,,,,,,,,,,,,,,,,,,,,,,,,,,,,,,,,,,,,,,,,,,,
"fixed the slide room motor controller, adjust the other two on the passenger side.
I AM ready to get out of dodge.",Electrical,,,,,,,,,,,,,,,,,,,,,,,,,,,,,,,,,,,,,,,,,,,,,,,,,,,,,,,,,,,,,,,,,
"Replaced fuel tank
sending unit, ordered from Alliance Coach as the mfg will not sell direct, $169.12. Total time including color coding wires, used colored zip ties, about 40 minutes. Easy job, had to enlist help from Son-in-law as my oversize belly would not allow me to safely get to the access cover in the storage compartment. Now for the first fill up. Was informed the unit comes preset from factory. Easy fix.",Chassis,,,,,,,,,,,,,,,,,,,,,,,,,,,,,,,,,,,,,,,,,,,,,,,,,,,,,,,,,,,,,,,,,
"Thread on old topper wore out - was just a single hem. Replaced Carefree Slide Topper.
Bought a new one will install today - easy job - saved hundreds. It is 133"" long and the carefree has an awning cover that is awkward for one person- but it's gone easy and we'll be ready to head toward Salt Lake City to meet some friends tomorrow a.m. (It'll be a two day trip for us - we don't do more than 3-4 hours a day and we're currently in S Utah.)",Exterior,,,,,,,,,,,,,,,,,,,,,,,,,,,,,,,,,,,,,,,,,,,,,,,,,,,,,,,,,,,,,,,,,
"Quote:
Originally Posted by Domo
Thread on old topper wore out - was just a single hem.
Bought a new one will install today - easy job - saved hundreds. It is 133"" long and the carefree has an awning cover that is awkward for one person- but it's gone easy and we'll be ready to head toward Salt Lake City to meet some friends tomorrow a.m. (It'll be a two day trip for us - we don't do more than 3-4 hours a day and we're currently in S Utah.)
cut my old one off and removed the rest last weekend. any tips on replacing it, mainly how to rewind it. when I got it loose and when it unwound tried to hit me lol. mine is also 133"" long
does the new fabric come with instructions as well?",Exterior,,,,,,,,,,,,,,,,,,,,,,,,,,,,,,,,,,,,,,,,,,,,,,,,,,,,,,,,,,,,,,,,,
"New vent cover
for Sharp microwave - couple weeks ago
Complete New windshield - thurs
Parts for toilet leak (refill only) in hand - next
Future
Slide topper
Guardian plates",Interior,,,,,,,,,,,,,,,,,,,,,,,,,,,,,,,,,,,,,,,,,,,,,,,,,,,,,,,,,,,,,,,,,
"New exhaust system
for the Onan Generator, hopefully arrive in the next three weeks. It fell off last time we ran it last week during a power outage at the campground.",Chassis,,,,,,,,,,,,,,,,,,,,,,,,,,,,,,,,,,,,,,,,,,,,,,,,,,,,,,,,,,,,,,,,,
"Atwood furnace
8535
Replaced noise blower motor
today no problem!
Closed it all backup and blower runs but no fire!
Open cover and it fires right up!
Close cover will not fire!
After several tries!
If ignition wire
is touching metal cover no fire!
Tie wire back against plastic blower housing and works fine.
Insulation in wire breaking down?",Electrical,,,,,,,,,,,,,,,,,,,,,,,,,,,,,,,,,,,,,,,,,,,,,,,,,,,,,,,,,,,,,,,,,
Just recently I replaced one of three arms on my large Girard awning. When pretty well for a solo job but two sets of hands would have been better.,Exterior,,,,,,,,,,,,,,,,,,,,,,,,,,,,,,,,,,,,,,,,,,,,,,,,,,,,,,,,,,,,,,,,,
Ran 50 amp sevice from the shop to the MH.,Electrical,,,,,,,,,,,,,,,,,,,,,,,,,,,,,,,,,,,,,,,,,,,,,,,,,,,,,,,,,,,,,,,,,
"Just replaced my series-32 kwikee steps. Controller had burned out. old steps still work, but would be semi manual if someone installed a ""rocker"" switch. [Mod Edit]",Electrical,,,,,,,,,,,,,,,,,,,,,,,,,,,,,,,,,,,,,,,,,,,,,,,,,,,,,,,,,,,,,,,,,
"Woke up Sunday morning at 4am with the unmistakable smell of burning electrical. Scary! Apparently the electric element in my water heater shorted out and burned up the EMS control board(s).
Being repaired tomorrow with two new boards and a new electric element for water heater. A tad over $1,000 parts and labor. Ouch, but could have been much worse.
If full timing flush those water heaters every 6 months.",Electrical,,,,,,,,,,,,,,,,,,,,,,,,,,,,,,,,,,,,,,,,,,,,,,,,,,,,,,,,,,,,,,,,,
Just replaced my series-32 kwikee step motor the plastic gear in it was stripped. On our last trip the step hit the ground when extended and never worked the same again. All works fine now.,Electrical,,,,,,,,,,,,,,,,,,,,,,,,,,,,,,,,,,,,,,,,,,,,,,,,,,,,,,,,,,,,,,,,,
"Moved my Remco 55 Aquajet-RVA water pump away from the wet bay wall, where it had been jammed at the Thor factory, nearly completely crimping off the inlet hose.
I saw this when taking out my Kantleak valve, which was dripping steady. The pump was also screwed to the wet bay flooring a wierd angle due to the indents in the floor. I used a short section of poly Board from Lowe's
I had left over, and rubber grommets to secure the board in s level configuration. I then mounted the pump to the flat board, bring sure to move it away from the wall enough to free up the inlet hose. Put it all back together, and wired in a switch to the 12v supply for the pump so I can turn the pump on, and off, when I'm working on the plumbing outside.
All worked out great, and I have increased water pressure!
My pump still will not cut off, after all valves are closed, it never has stopped completely.
I have checked for leaks, and found none.
Anyone have any idea what to look for next?",Plumbing and Water,,,,,,,,,,,,,,,,,,,,,,,,,,,,,,,,,,,,,,,,,,,,,,,,,,,,,,,,,,,,,,,,,
"Maxjr758, check to see if your ""city fill"" valve is completely shutting off. If it is not closed off entirely, or if the valve is not seating properly, the pressure the pump builds up will slowly leak past the ""city fill"" valve, back into the fresh water tank, resulting in lowered pressure, and your pump starting up to maintain the proper pressure. This happens to me if I forget to completely close off the city fill valve. Hope this helps!",Plumbing and Water,,,,,,,,,,,,,,,,,,,,,,,,,,,,,,,,,,,,,,,,,,,,,,,,,,,,,,,,,,,,,,,,,
"City water valve -tank fill valve.
We had that same problem. Got so bad that we'd only turn the pump on when needed. Finally took the valve apart and stuck in a new washer. What a difference a 50Â¢ part can make sometimes!",Plumbing and Water,,,,,,,,,,,,,,,,,,,,,,,,,,,,,,,,,,,,,,,,,,,,,,,,,,,,,,,,,,,,,,,,,
"Quote:
Originally Posted by Hit_the_Rhod
Maxjr758, check to see if your ""city fill"" valve is completely shutting off. If it is not closed off entirely, or if the valve is not seating properly, the pressure the pump builds up will slowly leak past the ""city fill"" valve, back into the fresh water tank, resulting in lowered pressure, and your pump starting up to maintain the proper pressure. This happens to me if I forget to completely close off the city fill valve. Hope this helps!
I have the Anderson 'Kantleak"" valve . I called Remco, they say completely fill the fresh water tank, open all faucets(hot and cold), run the washing machine, shower, outdoor shower, flush the toilets 3-4 times. This to get all the air out of the system, which they say I why the pump won't shut off. Said any air in the system is seen as a demand for water, by the sensor circuit In the pump controller.
I will check before I use all that water.",Plumbing and Water,,,,,,,,,,,,,,,,,,,,,,,,,,,,,,,,,,,,,,,,,,,,,,,,,,,,,,,,,,,,,,,,,
"Quote:
Originally Posted by Concord
City water valve -tank fill valve.
We had that same problem. Got so bad that we'd only turn the pump on when needed. Finally took the valve apart and stuck in a new washer. What a difference a 50Â¢ part can make sometimes!
Are you talking about the Orings on the cartridge, on the Anderson Kantleak valve? If so where did ya get the O rings ?",Plumbing and Water,,,,,,,,,,,,,,,,,,,,,,,,,,,,,,,,,,,,,,,,,,,,,,,,,,,,,,,,,,,,,,,,,
Refrigerator fix. Put two small 12 volt directional fans in back blowing up across heat exchanger. Went from 42 to 33 degrees. Individual switches.,Electrical,,,,,,,,,,,,,,,,,,,,,,,,,,,,,,,,,,,,,,,,,,,,,,,,,,,,,,,,,,,,,,,,,
"Quote:
Originally Posted by maxjr758
Are you talking about the Orings on the cartridge, on the Anderson Kantleak valve? If so where did ya get the O rings ?
For me, just the flat faucet washer.",Plumbing and Water,,,,,,,,,,,,,,,,,,,,,,,,,,,,,,,,,,,,,,,,,,,,,,,,,,,,,,,,,,,,,,,,,
"Finally got her winterized. Almost waited too long. Lines were partially frozen. Had to open the cupboards and turn the heat on for about 2 hours.
Then dumped 4 gallons of antifreeze in the tank, jacked up the front and the side so it would all run back to the corner where the pump is. Turned on the pump and sucked it through all the lines[emoji3]",Winterizing,,,,,,,,,,,,,,,,,,,,,,,,,,,,,,,,,,,,,,,,,,,,,,,,,,,,,,,,,,,,,,,,,
"Replaced bathroom Fantastic Vent with a Fantastic Vent remote control one.
Old one quit, new one much faster up and down.",Interior,,,,,,,,,,,,,,,,,,,,,,,,,,,,,,,,,,,,,,,,,,,,,,,,,,,,,,,,,,,,,,,,,
The rolled pin that holds the fantastic fan vent lid arm to the motor came out. Replaced it amd now it works great again.,Interior,,,,,,,,,,,,,,,,,,,,,,,,,,,,,,,,,,,,,,,,,,,,,,,,,,,,,,,,,,,,,,,,,
"New spring kits on all 4 jacks, slide lock motor and slide controller switch.",Chassis,,,,,,,,,,,,,,,,,,,,,,,,,,,,,,,,,,,,,,,,,,,,,,,,,,,,,,,,,,,,,,,,,
"Added window awnings, replaced patio awning, complete brake job and new seal in the toilet. Tucked away till February.",Exterior,,,,,,,,,,,,,,,,,,,,,,,,,,,,,,,,,,,,,,,,,,,,,,,,,,,,,,,,,,,,,,,,,
"I finally replaced my Magnum inverter display (idiot light version) with the total upgraded version....
Really simple install but an amazing difference in info I now have....",Lights,,,,,,,,,,,,,,,,,,,,,,,,,,,,,,,,,,,,,,,,,,,,,,,,,,,,,,,,,,,,,,,,,
"Quote:
Originally Posted by ernest917
I finally replaced my Magnum inverter display (idiot light version) with the total upgraded version....
Really simple install but an amazing difference in info I now have....
Attachment 227101
Attachment 227102
Attachment 227107
Mighty nice, something to think about getting for my Winnebago. Added to my research, â€œto-doâ€ and wish list!
Patrick",Lights,,,,,,,,,,,,,,,,,,,,,,,,,,,,,,,,,,,,,,,,,,,,,,,,,,,,,,,,,,,,,,,,,
"Quote:
Originally Posted by sinterior
Replaced bathroom Fantastic Vent with a Fantastic Vent remote control one.
Old one quit, new one much faster up and down.
Iâ€™m looking at doing this change out in the spring. Is it safe to say the electrical wiring for the old one is sufficient for the new fan? Looks like a relatively easy job.
Patrick",Interior,,,,,,,,,,,,,,,,,,,,,,,,,,,,,,,,,,,,,,,,,,,,,,,,,,,,,,,,,,,,,,,,,
"Quote:
Originally Posted by brokenrule
Added window awnings, replaced patio awning, complete brake job and new seal in the toilet. Tucked away till February. Attachment 227077Attachment 227078
Iâ€™m looking at installing a window awning, any words of wisdom? Any models you recommend?
Thanks,
Patrick",Exterior,,,,,,,,,,,,,,,,,,,,,,,,,,,,,,,,,,,,,,,,,,,,,,,,,,,,,,,,,,,,,,,,,
"Patrick.... when u buy ur new one ($135.00) you donâ€™t need the ME-RC50.... that one comes with 50â€™ of wiring that you donâ€™t need...
Buy the ME-RC version without the wiring.... itâ€™s a simple plug/play operation (has a telephone type plug)
Once you plug in new one it automatically updates info....
You will need to go into â€œsetupâ€ and make a few minor changes but the info you will now be able to see is amazing....
I plan on buying the gen auto-start add-on so I can use the AGS feature as well....",Electrical,,,,,,,,,,,,,,,,,,,,,,,,,,,,,,,,,,,,,,,,,,,,,,,,,,,,,,,,,,,,,,,,,
Replaced all the strings in one of my day/night shades. -Taxing! I think I could go into watch repair now!,Interior,,,,,,,,,,,,,,,,,,,,,,,,,,,,,,,,,,,,,,,,,,,,,,,,,,,,,,,,,,,,,,,,,
"Adjusted air mixture on the Atwood water heater
. Wore me out!!!",Heating and Cooling,,,,,,,,,,,,,,,,,,,,,,,,,,,,,,,,,,,,,,,,,,,,,,,,,,,,,,,,,,,,,,,,,
"Had to replace the motor in the power awning
defiantly not a one man job could not have done it without help from the boss lady also squeezed in a quick chassis lube.",Electrical,,,,,,,,,,,,,,,,,,,,,,,,,,,,,,,,,,,,,,,,,,,,,,,,,,,,,,,,,,,,,,,,,
I installed a derivation valve on my 12 volts pump to winterized the whole water system and plan shortly to install a inverter and solar panel as well an mechanics or hydraulic motorcycle carrier,Winterizing,,,,,,,,,,,,,,,,,,,,,,,,,,,,,,,,,,,,,,,,,,,,,,,,,,,,,,,,,,,,,,,,,
"Hit the Rhod.........
LOL. I KNOW how you Know. We took it to CW, the service guy came from around the the counter, went to my rig, crawled under it for a minute, then came back to the counter and said: Yep it's your Kwikee steps motor. He said we can get you in here in 2 weeks, it'll be $648. So I decided to have a little fun too, I said:""Uh, yeah...pencil me in for the appointment in 2 weeks, I'll be here bright n early."" well I never showed up. LOL. I orderd the motor AND the gear/linkage units on line for 183 and installed it myself. Soooo Now I can advise people that I can install this Ghizmo and charge them only $300.",Electrical,,,,,,,,,,,,,,,,,,,,,,,,,,,,,,,,,,,,,,,,,,,,,,,,,,,,,,,,,,,,,,,,,
"Had the pleasure of working in a phone booth and the bloody knuckles that went with it. Replaced the HWH hydraulic hose to the left front jack. The easy part was removing the hose from the controller, the dog part was trying to reach the hose connection on top of the jack. 4"" of space to try and turn the fitting loose all while using a mirror. Not fun, but done!",Chassis,,,,,,,,,,,,,,,,,,,,,,,,,,,,,,,,,,,,,,,,,,,,,,,,,,,,,,,,,,,,,,,,,
35 foot F53 chasis. Added a shim to passenger rear side to help bring it level.,Chassis,,,,,,,,,,,,,,,,,,,,,,,,,,,,,,,,,,,,,,,,,,,,,,,,,,,,,,,,,,,,,,,,,
We replaced our unusable manual awning arms and spring assembly with a new aftermarket Solara electric arms assembly. The manual awning was so high and the pull strap came out right in the center of our curb side slide which made it nearly impossible to use. Now with it electrified we hit the switch to unroll it and we are going to install a Vista Shade which will give us some shade something we have not had with the previous set up. It cost much more than I wanted but I can't stand not having good outside living space.,Electrical,,,,,,,,,,,,,,,,,,,,,,,,,,,,,,,,,,,,,,,,,,,,,,,,,,,,,,,,,,,,,,,,,
Just put new seals in my Sealand toilet.Boy what a crappy job !! LOL,"Adhesives, Sealants, and Cleaners",,,,,,,,,,,,,,,,,,,,,,,,,,,,,,,,,,,,,,,,,,,,,,,,,,,,,,,,,,,,,,,,,
"Water pump case seal failed and leaked. Some water damage to the OSB shelf the 50 gallon water tank is set on which is buried under the bed along the back wall of the coach.
Removed the bed and framing to gain access. With the tank out, all the associated plumbing and the problem pump I was able to dry out the wood out with heaters. Couple of soft spots but for the most part the shelf was sound. Sealed the OSB with penetrating epoxy, replaced the pump with a better model and rework the plumbing adding soft flexible tubing to help quiet the pump. Reworked the framing for the bed, side shelves along with insulating and draft sealing the entire area.
The epoxy worked out really well. Very thin and penetrated the OSB eliminating the soft spots and preventing further water damage should the tank or plumbing ever leak again.
https://www.amazon.com/gp/product/B0...?ie=UTF8&psc=1",Plumbing and Water,,,,,,,,,,,,,,,,,,,,,,,,,,,,,,,,,,,,,,,,,,,,,,,,,,,,,,,,,,,,,,,,,
"Sweetbriar:
Quote:
Water pump case seal failed and leaked. Some water damage to the OSB shelf the 50 gallon water tank is set on which is buried under the bed along the back wall of the coach.
Nice repair job[emoji106][emoji106][emoji106][emoji106]",Plumbing and Water,,,,,,,,,,,,,,,,,,,,,,,,,,,,,,,,,,,,,,,,,,,,,,,,,,,,,,,,,,,,,,,,,
"I installed a new ignition switch
. Checked with youtube first to see how it is installed and they had one installing the ignition switch
on a Fore travel which was exactly the same type mine had. Luckily I checked because I did not know how to remove the tumblers. Found out that by inserting a straight pin and the key turned to the ACC spot the whole thing just comes out. It took me about 15 minutes to install the switch. Everything works good now.",Chassis,,,,,,,,,,,,,,,,,,,,,,,,,,,,,,,,,,,,,,,,,,,,,,,,,,,,,,,,,,,,,,,,,
Tried to replace the pilot light flame sensor on my father-in-laws 1992 miniwinnie but no luck - little brass fitting frozen to the regulator. Too big of a job for me; time for the mobile guy to replace the water heater.,Electrical,,,,,,,,,,,,,,,,,,,,,,,,,,,,,,,,,,,,,,,,,,,,,,,,,,,,,,,,,,,,,,,,,
"Had a puddle of watyer on the floor outside the bathroom. Shower drain came loose - easy free fix.
Someone didn't put the rear vent down with one of those vent insulation pads installed before driving off. $80 later it was fixed. Hate using the dealers, but they had the part, the time to fix it and it was raining.",Plumbing and Water,,,,,,,,,,,,,,,,,,,,,,,,,,,,,,,,,,,,,,,,,,,,,,,,,,,,,,,,,,,,,,,,,
"Quote:
Originally Posted by mike brez
The broken gasket is not on the exhaust side
Are you sure about that? It certainly looks like a turbo mounting gasket to me.(exhaust manifold to turbo).
That is always under pressure, and will blow out. Seeing the black exhaust soot is also a bit of a giveaway.
Happy Glamping.",Chassis,,,,,,,,,,,,,,,,,,,,,,,,,,,,,,,,,,,,,,,,,,,,,,,,,,,,,,,,,,,,,,,,,
"Quote:
Originally Posted by Unplanned
Are you sure about that? It certainly looks like a turbo mounting gasket to me.(exhaust manifold to turbo).
That is always under pressure, and will blow out. Seeing the black exhaust soot is also a bit of a giveaway.
Happy Glamping.
I 99.9% sure
This is the exhaust side much dirtier and sooty
This image has been resized. Click this bar to view the full image. The original image is sized %1%2.",Chassis,,,,,,,,,,,,,,,,,,,,,,,,,,,,,,,,,,,,,,,,,,,,,,,,,,,,,,,,,,,,,,,,,
"Quote:
Originally Posted by mike brez
I 99.9% sure
This is the exhaust side much dirtier and sooty
This image has been resized. Click this bar to view the full image. The original image is sized %1%2.
The gasket in your pictures is the exhaust manifold
to turbo gasket. Intake side of exhaust housing if you like, but still the exhaust side. It's the exhaust pressure that spins the compressor wheel to build boost.
Your compressor wheel is the damaged one. Something got into the intake piping and did that damage. I have seen it many, many times when I worked on trucks.
Happy Glamping.",Chassis,,,,,,,,,,,,,,,,,,,,,,,,,,,,,,,,,,,,,,,,,,,,,,,,,,,,,,,,,,,,,,,,,
"Quote:
Originally Posted by Unplanned
The gasket in your pictures is the exhaust manifold
to turbo gasket. Intake side of exhaust housing if you like, but still the exhaust side. It's the exhaust pressure that spins the compressor wheel to build boost.
Your compressor wheel is the damaged one. Something got into the intake piping and did that damage. I have seen it many, many times when I worked on trucks.
Happy Glamping.
Yes you are 100% correct",Chassis,,,,,,,,,,,,,,,,,,,,,,,,,,,,,,,,,,,,,,,,,,,,,,,,,,,,,,,,,,,,,,,,,
"Oh, forgot one! Swapped out old dim 5x7 headlights with LED versions. WOW, what a difference! The light is a little uneven but so much better than the factory headlights it doesn't matter. Because these LED headlight
draw less amps and operate just fine on lower voltage, there's no need to upgrade the factory wiring.
These are the one's I used:
https://www.amazon.com/gp/product/B0...?ie=UTF8&psc=1",Lights,,,,,,,,,,,,,,,,,,,,,,,,,,,,,,,,,,,,,,,,,,,,,,,,,,,,,,,,,,,,,,,,,
"Today I scraped the old sealant off the front cap, the front fan and the antenna. Getting ready to reseal the whole roof[ATTACH]245662","Adhesives, Sealants, and Cleaners",,,,,,,,,,,,,,,,,,,,,,,,,,,,,,,,,,,,,,,,,,,,,,,,,,,,,,,,,,,,,,,,,
Also pulled down the shroud forthe bedroom exhaust fan to see if it was prewired for an a/c unit. It is!!!! Might need to upgrade to 50 amp now[ATTACH]245664,Heating and Cooling,,,,,,,,,,,,,,,,,,,,,,,,,,,,,,,,,,,,,,,,,,,,,,,,,,,,,,,,,,,,,,,,,
"Installed a Trik-L-Start controller today. - I think I really like it, normally nothing charges the chassis battery, I had to keep a trickle charger on it. After installing the unit today, it only took a few hours to bring all the batteries up to the same charge just using my solar panels. No more extra chargers to hook up and I don't even have to think about it.",Electrical,,,,,,,,,,,,,,,,,,,,,,,,,,,,,,,,,,,,,,,,,,,,,,,,,,,,,,,,,,,,,,,,,
"Quote:
Originally Posted by mike brez
Was in South Carolina noticed loss of power and some black smoke out of exhaust. Lifted up bed and removed cover found gasket between exhaust manifold
and turbo leaking. Drove it home 18 hours took it apart at home after soaking with acetone&atf mixture for couple days hoping not to snap off a stud. After taking turbo out found compressor wheel chewed up. I know you all like pics.
This image has been resized. Click this bar to view the full image. The original image is sized %1%2.
This image has been resized. Click this bar to view the full image. The original image is sized %1%2.
This image has been resized. Click this bar to view the full image. The original image is sized %1%2.
This image has been resized. Click this bar to view the full image. The original image is sized %1%2.
That looks familiar. I had a broken exhaust manifold
. Turbo was chewed up some but the seals were leaking also.",Chassis,,,,,,,,,,,,,,,,,,,,,,,,,,,,,,,,,,,,,,,,,,,,,,,,,,,,,,,,,,,,,,,,,
Replaced the electric raise and lower over the air antennae with a fixed model.,Electrical,,,,,,,,,,,,,,,,,,,,,,,,,,,,,,,,,,,,,,,,,,,,,,,,,,,,,,,,,,,,,,,,,
changed out all my fluorescent lights to LED's. I had one of the fluorescent's on for about 30 minutes before I took it down and dang it was warm. they should cut down on heat as well as electrict,Lights,,,,,,,,,,,,,,,,,,,,,,,,,,,,,,,,,,,,,,,,,,,,,,,,,,,,,,,,,,,,,,,,,
Installed my new Xantrex 2000 watt inverter and 2 new US Battery 232 Ah batteries to go along with the two already onboard house batteries. Now I can boondock for 7-8 days without running the generator. Yay!,Electrical,,,,,,,,,,,,,,,,,,,,,,,,,,,,,,,,,,,,,,,,,,,,,,,,,,,,,,,,,,,,,,,,,
"I used one strip of these SMD LED strip lights in place of each thin light fluorescent bulb. Two strips per fixture.
https://www.amazon.com/gp/product/B0...?ie=UTF8&psc=1
You have to remove the old ballast assembly and wire 12v directly to each strip of LED's.
I see this roll of LED's is not available, but there are several other rolls almost identical.
It helps if you purchase a package of non-solder strip light connectors.
https://www.amazon.com/gp/product/B0...?ie=UTF8&psc=1",Lights,,,,,,,,,,,,,,,,,,,,,,,,,,,,,,,,,,,,,,,,,,,,,,,,,,,,,,,,,,,,,,,,,
Got to camp and water was dripping out of one of my storage bays. Looked into it after tearing my bed apart to access the water tank and found the vent hose had come detached from the gravity fill port on the outside. Got it all dried out and hooked back up. Love it when it's an easy fix!!,Plumbing and Water,,,,,,,,,,,,,,,,,,,,,,,,,,,,,,,,,,,,,,,,,,,,,,,,,,,,,,,,,,,,,,,,,
"2004 MADP: My weekend project was to make it easier for DW to use the coach's dash stereo. She gets up early and likes to listen to the radio while getting ready for the day. I found and ordered a Carling L24D1 DPDT (on-none-on) rocker switch that matches the coach's original dash rocker switches and fits exactly in a blanked off unused switch location on the dash. Now she can flip the switch up and the radio is fed 12v battery
power, flip it back down and the radio is fed switched ignition power like normal. Makes it easy to use the stereo while parked without turning on the key. A simple and useful project.
As long as I had the dash apart, I repurposed the old ""Nav System"" dash toggle that controlled the GPS in the old dash stereo I ripped out about a year ago. Now it switches 12v battery
power to power the new backup camera and its video display monitor that I installed so I can see what is behind the coach whether driving or parked.",Electrical,,,,,,,,,,,,,,,,,,,,,,,,,,,,,,,,,,,,,,,,,,,,,,,,,,,,,,,,,,,,,,,,,
Removed shower valve and bought a real one at the Home Despot. Bought a GFO outlet to replace the one that was in the dash that burst into flames.,Plumbing and Water,,,,,,,,,,,,,,,,,,,,,,,,,,,,,,,,,,,,,,,,,,,,,,,,,,,,,,,,,,,,,,,,,
