content,product,,,,,,,,,,,,,,,,,,,,,,,,,,,,,,,,,,,,,,,,,,,,,,,,,,,,,,,,,,,,,,,,,
"I finally pinned myself down to have a closer look at my Attwood WH that would not stay ignited. It worked when we first got the MH and declined to were it would kick off seconds after being fired up.
We have motoraid so no problem wallydocking as we usually clean up the night before. We have always stayed at 50A locations but have a spot booked in Myrtle Beach that is only 30A which is smoother if the water heater can run on gas.
Anyway I found the connections on the board corroded and the molux connector pins corroded. Cleaned those up the best I could without removing the pins and cleaned the board connections.
Found the board sealed in resin on a 2004 model that mentioned to check for bad traces on the board. I imagine its been replaced at some point.
Interesting to see it sealed probably to protect it from the elements. I worked for Rockford Fosgate
in the 80s and they sealed their boards in resin and silica sand to hopefully prevent other companies from stealing their tech. Hadn't thought about it in forever until seeing this board jogged the memory loose. I would bet their stuff is no longer hand made in the good ole USA.
Anyway, I digress. I put it all together and flipped the switch and it did absolutely nothing. I was like hmmm. Not intermittent anymore. Waited a few minutes and nothing. Even had a shower to run the water out of the tank with the 115 element off and nothing. Not even a click of the gas valve.
My little voice to the rescue. It told me to close it up and wish it a safe trip home and it will probably work when we get there. Lo and behold, flip the switch and it doesn't do anything. Wait about 10 seconds and it bursts into life and stayed on for quite a while before I cut it off. Im thinking about ordering an eco board and flame sensor just in case. The flame sensor was pretty cruddy.
I also need to replace the release valve. It drips under pressure.",Electrical,,,,,,,,,,,,,,,,,,,,,,,,,,,,,,,,,,,,,,,,,,,,,,,,,,,,,,,,,,,,,,,,,
"Replaced the left side windscreen, as well as 6 of the underbay hatch struts
. Plan on new front privacy curtains.",Exterior,,,,,,,,,,,,,,,,,,,,,,,,,,,,,,,,,,,,,,,,,,,,,,,,,,,,,,,,,,,,,,,,,
"01 pseries workhorse 8.1L coolant temp sensor....hard cold start. - replaced three wire sensor was causing hard cold start.....squirting fuel down throttle throat and motor would start right up indicated lean fuel trim. Evidently sensor was telling ECM engine was warm when it was actually cold.
Its on passenger side thru tire well....used 22mm open end wrench move fast and u barely lose any coolant.
Standard Motor Parts TX102 from amazon......they say its wrong part but they are WRONG....86$.",Electrical,,,,,,,,,,,,,,,,,,,,,,,,,,,,,,,,,,,,,,,,,,,,,,,,,,,,,,,,,,,,,,,,,
"A year or so ago I removed the old single DIN Panasonic
integrated dash stereo, GPS, 6 CD changer and flip up backup camera display. I mounted a new 7"" Pyle display monitor under the overhead entertainment cabinet for the backup camera and TripTek display. I used a wireless RCA video device from Amazon to connect the monitor to the old backup camera and TripTek video connection under the dash.
The wireless video just wasn't acceptable, so yesterday I fished a RCA video cable from under the dash, up under the passenger side A pillar cover and through the upper cabinets to the Pyle video monitor. It was a little more of a challenging and arduous project than I thought, but it turned out great.
Here is a bad picture showing the Pyle monitor under the left side of the overhead cabinet:",Hardware,,,,,,,,,,,,,,,,,,,,,,,,,,,,,,,,,,,,,,,,,,,,,,,,,,,,,,,,,,,,,,,,,
"Alternator went out, found a shop that rebuilds them. 45 minutes to get out, hour and a half to get back in. 133 bucks after tax and she is purring like a kitten. Also cleaned up some connections and got the emergency start to work. Now I just need to figure out how to get the house batteries to charge off of the alternator",Electrical,,,,,,,,,,,,,,,,,,,,,,,,,,,,,,,,,,,,,,,,,,,,,,,,,,,,,,,,,,,,,,,,,
"Time for the fluid changes. Engine and genset motor oil, pulling samples of all fluids to send to Blackstone Labs as I do every year. In fact when they send me the reports they say ""See you next spring!"" Well worth the piece of mind that nothing has changed in all the internals.
All filters, grease the chassis and flush the brake fluid.",Chassis,,,,,,,,,,,,,,,,,,,,,,,,,,,,,,,,,,,,,,,,,,,,,,,,,,,,,,,,,,,,,,,,,
"Repaired oil leak on valve cover
and engine brake spacer housing. At the same time I adjusted the valves.
Bill",Chassis,,,,,,,,,,,,,,,,,,,,,,,,,,,,,,,,,,,,,,,,,,,,,,,,,,,,,,,,,,,,,,,,,
"Air filter, propane regulator
, door seal. Little fixes/maintenance stuff",Hardware,,,,,,,,,,,,,,,,,,,,,,,,,,,,,,,,,,,,,,,,,,,,,,,,,,,,,,,,,,,,,,,,,
"Was in South Carolina noticed loss of power and some black smoke out of exhaust. Lifted up bed and removed cover found gasket between exhaust manifold
and turbo leaking. Drove it home 18 hours took it apart at home after soaking with acetone&atf mixture for couple days hoping not to snap off a stud. After taking turbo out found compressor wheel chewed up. I know you all like pics.
This image has been resized. Click this bar to view the full image. The original image is sized %1%2.
This image has been resized. Click this bar to view the full image. The original image is sized %1%2.
This image has been resized. Click this bar to view the full image. The original image is sized %1%2.
This image has been resized. Click this bar to view the full image. The original image is sized %1%2.",Chassis,,,,,,,,,,,,,,,,,,,,,,,,,,,,,,,,,,,,,,,,,,,,,,,,,,,,,,,,,,,,,,,,,
"Quote:
Originally Posted by mike brez
Was in South Carolina noticed loss of power and some black smoke out of exhaust. Lifted up bed and removed cover found gasket between exhaust manifold
and turbo leaking. Drove it home 18 hours took it apart at home after soaking with acetone&atf mixture for couple days hoping not to snap off a stud. After taking turbo out found compressor wheel chewed up. I know you all like pics.
This image has been resized. Click this bar to view the full image. The original image is sized %1%2.
This image has been resized. Click this bar to view the full image. The original image is sized %1%2.
This image has been resized. Click this bar to view the full image. The original image is sized %1%2.
This image has been resized. Click this bar to view the full image. The original image is sized %1%2.
So have you checked upstream of the turbo to see how whatever did the damage got into the fresh air supply?",Chassis,,,,,,,,,,,,,,,,,,,,,,,,,,,,,,,,,,,,,,,,,,,,,,,,,,,,,,,,,,,,,,,,,
"Quote:
Originally Posted by Hit_the_Rhod
So have you checked upstream of the turbo to see how whatever did the damage got into the fresh air supply?
Not yet but I'm guessing it was the missing peices of the gasket.
Going to air test the air charge cooler tomorrow then remove the bottom hose to see if anything is laying around that area.",Chassis,,,,,,,,,,,,,,,,,,,,,,,,,,,,,,,,,,,,,,,,,,,,,,,,,,,,,,,,,,,,,,,,,
Bummer ! Lost a Gasket there quite a few yrs ago . I know the drill - Your Turbo Definitely ate something metallic. Your Gasket looks similar to the one I had- I replaced it with a Metallic Wafer type gasket and it was Thicker than OE.,Chassis,,,,,,,,,,,,,,,,,,,,,,,,,,,,,,,,,,,,,,,,,,,,,,,,,,,,,,,,,,,,,,,,,
"Quote:
Originally Posted by mike brez
Not yet but I'm guessing it was the missing peices of the gasket.
Going to air test the air charge cooler tomorrow then remove the bottom hose to see if anything is laying around that area.
That missing part of gasket will have gone out. That is on the exhaust side anyway.
Your compressor side probably was damaged long before the gasket went. It doesn't take much to do the damage it has. You will likely see a real improvement in power and economy after you replace the turbo.
I have seen damage like that many times from some little bits that got into the clean side of the intake system
somehow.
Just be sure to clean all the piping between the air filter and turbo. Remember, cleanliness is next to godliness in your intake system
.
Happy Glamping.",Chassis,,,,,,,,,,,,,,,,,,,,,,,,,,,,,,,,,,,,,,,,,,,,,,,,,,,,,,,,,,,,,,,,,
"Quote:
Originally Posted by Unplanned
That missing part of gasket will have gone out. That is on the exhaust side anyway.
Your compressor side probably was damaged long before the gasket went. It doesn't take much to do the damage it has. You will likely see a real improvement in power and economy after you replace the turbo.
I have seen damage like that many times from some little bits that got into the clean side of the intake system
somehow.
Just be sure to clean all the piping between the air filter and turbo. Remember, cleanliness is next to godliness in your intake system
.
Happy Glamping.
The broken gasket is not on the exhaust side",Chassis,,,,,,,,,,,,,,,,,,,,,,,,,,,,,,,,,,,,,,,,,,,,,,,,,,,,,,,,,,,,,,,,,
"Fixed a weld that popped on the 1/4"" rod that keeps both sides of our fold out steps aligned.. I stepped onto the lower step and heard a loud pop and found the weld that fixed the rod to the side plate had let go.. Used a small oxy/acetylene torch kit with some brazing rod and had it working like new in about 15 minutes.
God I love easy fixes!!",Exterior,,,,,,,,,,,,,,,,,,,,,,,,,,,,,,,,,,,,,,,,,,,,,,,,,,,,,,,,,,,,,,,,,
"Replaced the wiring in the dash that Freightliner felt was the cause of my low brake pressure alarm
Found the Air leak that caused the low brake alarm, it was a crack on the 4 in 1 Gage. Ordered Gage.",Electrical,,,,,,,,,,,,,,,,,,,,,,,,,,,,,,,,,,,,,,,,,,,,,,,,,,,,,,,,,,,,,,,,,
Replaced the multifunction gauge on my freightliner chassis last year. No aftermarket matching gauges exist that I could find. I have been lucky in the past and found manufactures names or part numbers on parts because freightliner has parts made for them by other companies but no luck with the gauge. Cost about $500 as I remember.,Chassis,,,,,,,,,,,,,,,,,,,,,,,,,,,,,,,,,,,,,,,,,,,,,,,,,,,,,,,,,,,,,,,,,
"Ours has the 2 way frig mounted in the slide. It's gone 16 plus years just fine but I noticed on our last trip, that the condenser cooling fan
was running more often than normal. Got home and climbed up to check for obstructions through the upper hatch. Found the fins to be a bit dirty and surface rusted so cleaned them up. Had one dirt dauber nest on one end and removed it.
I also noticed there was a metal deflector installed to focus air flow over the coil. There was a large gap though, about 2 inches wide, that I'm fairly certain was allowing too much air flow to bypass the coil. Unscrewed, drilled out the pop rivets, then reinstalled with less gap to concentrate more air flow over the coil. Thinking this will help to make cooling more efficient in the hot weather we sometimes have to endure.",Chassis,,,,,,,,,,,,,,,,,,,,,,,,,,,,,,,,,,,,,,,,,,,,,,,,,,,,,,,,,,,,,,,,,
"Every time my DW opened the front slides I hear, I hate them spots. Will see if she notices.",Electrical,,,,,,,,,,,,,,,,,,,,,,,,,,,,,,,,,,,,,,,,,,,,,,,,,,,,,,,,,,,,,,,,,
"It rained like all get out for the last two days and I sprung a leak around the air conditioner in the bedroom. DW was not happy to wake up in the middle of the night with water dripping on her head! I took the cover off and tightened the 4 bolts down holding it to the roof. Hopefully this will fix the problem. It's supposed to rain again in the next few days. Keeping my fingers crossed!
I also got up on the roof and put some Eternabond on a couple of small cracks I saw up there which I'm sure was not the cause of the major leak we had. Put some Dicor around the base of the air conditioner as well while I was up there.",Plumbing and Water,,,,,,,,,,,,,,,,,,,,,,,,,,,,,,,,,,,,,,,,,,,,,,,,,,,,,,,,,,,,,,,,,
"Quote:
Originally Posted by PaulAchuff
It rained like all get out for the last two days and I sprung a leak around the air conditioner in the bedroom. DW was not happy to wake up in the middle of the night with water dripping on her head! I took the cover off and tightened the 4 bolts down holding it to the roof. Hopefully this will fix the problem. It's supposed to rain again in the next few days. Keeping my fingers crossed!
I also got up on the roof and put some Eternabond on a couple of small cracks I saw up there which I'm sure was not the cause of the major leak we had. Put some Dicor around the base of the air conditioner as well while I was up there.
You should probably also check the weep holes up there under the a/c unit. If they're clogged, water will back up in the pan and then leak inside.",Plumbing and Water,,,,,,,,,,,,,,,,,,,,,,,,,,,,,,,,,,,,,,,,,,,,,,,,,,,,,,,,,,,,,,,,,
"One of my other projects was to discontinue the constant condensation water on the roof creating algae and white stains on the side of my newly painted Newmar. The other was to inspect the now known poor workmanship done by North Trail
Rv. I removed both a/c units and used the aluminum duct tape to secure and seal all the duct work back into place. Then with some 1-1/2â€ square aluminum tube created a collar to raise the unit enough to install condensate drains and tubing to feed over to the two roof vents
. After a few weeks now itâ€™s so nice not to have those stains on side walls and water dripping and splashing debris on coach and wheels.",Plumbing and Water,,,,,,,,,,,,,,,,,,,,,,,,,,,,,,,,,,,,,,,,,,,,,,,,,,,,,,,,,,,,,,,,,
Went to start the Itasca Meridian and heard a big boom! One of the chassis batteries exploded! Washed everything down after a hefty amount of baking soda. That battery certainly blew with plastic everywhere. Replaced both seven year old chassis batteries and all is fine now!,Electrical,,,,,,,,,,,,,,,,,,,,,,,,,,,,,,,,,,,,,,,,,,,,,,,,,,,,,,,,,,,,,,,,,
"completely renewed the engine compartment (diesel pusher). New seals around bed frame and new heat/sound insulation. The fabric over the engine was ripped and sagging, so I replaced it with stuff from the local hot rod shop (the foil looking material in the pic). I re-used the sheet fiberglass core and glued the foil stuff over it. i washed the engine and sprayed a coat of engine detailer. looks amazing...except for all the missing ""Caterpillar Yellow"" paint.",Electrical,,,,,,,,,,,,,,,,,,,,,,,,,,,,,,,,,,,,,,,,,,,,,,,,,,,,,,,,,,,,,,,,,
"I took it to the Ford dealer for a spa day. Tires rotated, front end greased, e-brake adjustment and brake check. They just called and the drag link boot is torn and is being replaced under warranty.
I had the oil changed at the RV dealer (Lazy Days) three months ago for $250. The Ford dealer does it for $120! Next time I know where itâ€™s going.",Chassis,,,,,,,,,,,,,,,,,,,,,,,,,,,,,,,,,,,,,,,,,,,,,,,,,,,,,,,,,,,,,,,,,
"Quote:
Originally Posted by BirchyBoy
I took it to the Ford dealer for a spa day. Tires rotated, front end greased, e-brake adjustment and brake check. They just called and the drag link boot is torn and is being replaced under warranty.
I had the oil changed at the RV dealer (Lazy Days) three months ago for $250. The Ford dealer does it for $120! Next time I know where itâ€™s going.
Both prices are insanely high!
I use the Motorcraft Oil and Motorcraft filter specified in the manual - and I pay about $27 for 6 quarts of oil and filter!",Chassis,,,,,,,,,,,,,,,,,,,,,,,,,,,,,,,,,,,,,,,,,,,,,,,,,,,,,,,,,,,,,,,,,
Replaced the $650 4 in one instrument on the dash of my 3008 Freightliner chassis. It had cracked and begun leaking air giving a break warning. It fixed the problem.,Chassis,,,,,,,,,,,,,,,,,,,,,,,,,,,,,,,,,,,,,,,,,,,,,,,,,,,,,,,,,,,,,,,,,
"Had a seized solid wastegate that caused problems with the turbocharger. Had to replace it and did it by myself. Got done, I trust CAT more than eBay and paid for it to the tune of $2,100.00 with all parts to replace old ones. Took my time and learned more than I wanted to on turbocharger exhaust clamps!",Electrical,,,,,,,,,,,,,,,,,,,,,,,,,,,,,,,,,,,,,,,,,,,,,,,,,,,,,,,,,,,,,,,,,
changed the serpentine belt.Found out that I could pull tensioner down using both hands while underneath the coach to put belt on.,Chassis,,,,,,,,,,,,,,,,,,,,,,,,,,,,,,,,,,,,,,,,,,,,,,,,,,,,,,,,,,,,,,,,,
"Radiator was leaking like a waterfall on my Solei 34t by Winnebago. They said out of warrantee too bad for you so now 5 year old coach can need a radiator replaced. No alternative but to spend $3600.00 at freightliner for the repair which required then to remove the bed and part of rear floor as hatch was not big enough. I have had vehicles go 15 years and many miles with out replacing a radiator. But we are living in times where manufactures such as freightliner hide behind their warrantee when they install defective parts. Radiator should last longer than 5 years and 24,800 miles. Wife talking about bigger coach but she likes Forza and Holiday Rambler also built on Freightliner chassis and I am not biting burn me once shame on you burn me twice shame on me! Freightliner used to be reliable honorable brand not anymore IMO!",Electrical,,,,,,,,,,,,,,,,,,,,,,,,,,,,,,,,,,,,,,,,,,,,,,,,,,,,,,,,,,,,,,,,,
"Quote:
Originally Posted by evanslb19
Radiator was leaking like a waterfall on my Solei 34t by Winnebago. They said out of warrantee too bad for you so now 5 year old coach can need a radiator replaced. No alternative but to spend $3600.00 at Freightliner for the repair which required then to remove the bed and part of rear floor as hatch was not big enough. I have had vehicles go 15 years and many miles with out replacing a radiator. But we are living in times where manufactures such as Freightliner hide behind their warrantee when they install defective parts. Radiator should last longer than 5 years and 24,800 miles. Wife talking about bigger coach but she likes Forza and Holiday Rambler also built on Freightliner chassis and I am not biting burn me once shame on you burn me twice shame on me! Freightliner used to be reliable honorable brand not anymore IMO!
Sorry for your radiator woes. We ran through a radiator problem with out 2001 Dutch Star. Radiator started leaking, limped to a Freightliner shop. They recommended NOT using the Freightliner radiator as they had a lot of problems with them. They recommended a local speed shop who built radiators from scratch, better built, better warranty, took a week to remove, take to shop, shop built radiator, reinstalled. That was three years and 25k miles ago. No issues since. Oh, and for history, the PO replaced the Freightliner radiator 5 (FIVE) times in 120k miles . . . One was road damage, installed wrong radiator and replaced it with correct one, no charge, that one was faulty radiator, failed after maybe 3 months, replaced, no charge, the other two were unexplained. So fingers crossed, hope this ""built"" one lasts as long as we have coach!",Electrical,,,,,,,,,,,,,,,,,,,,,,,,,,,,,,,,,,,,,,,,,,,,,,,,,,,,,,,,,,,,,,,,,
"Slide topper replacement
Stone Vos-chat with owner Ingrid and educate yourself on their material options.
Just replaced the 4th of 4 toppers(3 of 4 last year).....very happy with'em.",Exterior,,,,,,,,,,,,,,,,,,,,,,,,,,,,,,,,,,,,,,,,,,,,,,,,,,,,,,,,,,,,,,,,,
"Quote:
Originally Posted by ChainSaw
I just finished refurbishing my Tandem Tow HD.
That thing is SWEET. Now.
As for me, today I added some dye to the dash AC so hopefully tomorrow I can find the freon leak. While I was at that I hooked up a scope to the ignition to see what might be causing a misfire and loss of power. Lean firing line in #7 and #8. Well, I was meaning to do an injector service anyway. Already bought the o-rings. So second item on the to-do list tomorrow is to pull the injectors for a look-see I guess. Ford 7.5, so not a terribly big deal.",Electrical,,,,,,,,,,,,,,,,,,,,,,,,,,,,,,,,,,,,,,,,,,,,,,,,,,,,,,,,,,,,,,,,,
"Had trouble with my brakes keeping the air pressure up. I replaced air dryer first then the governor with no results. So I thought must be compressor so I got the top end kit. I took it apart and found a piece broken and replaced it.
Started it up and pressure went up great so I thought I had fixed it, not so quick. After about twenty miles down the road air pressure dropped without even using the air Sooo back to work.
I pulled the top of the compressor back off and everything was fineðŸ˜•. I figured out that while it was cooled off it would pump up but would not stay up. So I decided to get another governor this time I bought one from Bendix ( the mfg.) of the compressor and not an off brand. That was the problem. I was lucky because all this happened about twenty miles from home.
Just a heads up on this problem.",Chassis,,,,,,,,,,,,,,,,,,,,,,,,,,,,,,,,,,,,,,,,,,,,,,,,,,,,,,,,,,,,,,,,,
We purchased a 95 Gulfstream DP. The floor was rotted out. I finished the floor in the front and just finished putting the kitchen cabinets back in with a new sink. Attacking the bathroom next.,Hardware,,,,,,,,,,,,,,,,,,,,,,,,,,,,,,,,,,,,,,,,,,,,,,,,,,,,,,,,,,,,,,,,,
"Quote:
Originally Posted by Seasoned Grace
We purchased a 95 Gulfstream DP. The floor was rotted out. I finished the floor in the front and just finished putting the kitchen cabinets back in with a new sink. Attacking the bathroom next.
Nice. Pictures please if you have them. Always like to see the improvements.",Hardware,,,,,,,,,,,,,,,,,,,,,,,,,,,,,,,,,,,,,,,,,,,,,,,,,,,,,,,,,,,,,,,,,
"Quote:
Originally Posted by Jbertram2
Iâ€™ve replace both of the thermostats Still no heat
Not much to go on...There is in most RV water
heaters, a thermal fuse. It's under the outside access plate. It's covered with a black sleeve. A little bullet shaped device that fails seemingly at random and shuts down the WH. It's obvious when you try to ohm it out. It should read zero but when bad will read 1. Or infinity depending on meter.
I believe the output wire from it is purple and goes to a 1/4"" terminal on the ESI board. Check for 12 volt there. If it's zero volt, the thermal fuse is bad.
The printing on the fuse give enough info to google it. Amazon and eBay carry them. So do most electrical supply places. So do RV stores.
This all assumes you usually try to heat your water with propane. But if the thermal fuse is bad, some ESI control boards will shut off the electric element relay too.",Heating and Cooling,,,,,,,,,,,,,,,,,,,,,,,,,,,,,,,,,,,,,,,,,,,,,,,,,,,,,,,,,,,,,,,,,
"Quote:
Originally Posted by GMoore
Power Gear hydraulic leveling system. 19 year old motor rusted up, bad noises coming from the pump.
Motor sits on a plate with pump below in the fluid reservoir. You can see the bearing, it wouldn't turn.
Replaced the motor, bearing, seal on the pump shaft and cleaned up the plate.
On a gasser all this sits behind the front grill, everything gets wet driving in the rain.
Now it is the quietest it has ever been.
Mine pump etc. is midship by my genset.",Chassis,,,,,,,,,,,,,,,,,,,,,,,,,,,,,,,,,,,,,,,,,,,,,,,,,,,,,,,,,,,,,,,,,
"Quote:
Originally Posted by MikeGee
Just installed qty 2 new Group 31 chassis batteries. Now working on air dryer that is purging too frequently. Have replaced the dryer filter and rebuilt the lower end (valves) with Haldex kit. Will start looking for / chasing leaks at this point. This rig has pretty much been my retirement project for a year or so. Keeps me broke and out of trouble. ;-)
Air dryer cycling issues are almost never caused by the air dryer. Every time the compressor unloads the dryer purges. Find out why the system won't hold pressure and your cycling issue will be cured.
OTOH, rebuilding the dryer can't hurt anything.
If you don't find an external leak start testing valves.",Electrical,,,,,,,,,,,,,,,,,,,,,,,,,,,,,,,,,,,,,,,,,,,,,,,,,,,,,,,,,,,,,,,,,
"Many times the leaks are in the 1/4 "" lines between the dryer, governor and wet tank. If the governor is remote mounted, there is one more line to check.
The air pressure gauges don't monitor the wet tank, so the leak could be undetected while in the cab.
In a few cases, I've temporarily installed a air gauge in the drain valve port of the wet tank to check the lines for leaks.
The wet tank will be one end of the longer air tank with 2 drains. Look for the seam around it. The wet tank will be the shorter section.",Chassis,,,,,,,,,,,,,,,,,,,,,,,,,,,,,,,,,,,,,,,,,,,,,,,,,,,,,,,,,,,,,,,,,
"Quote:
Originally Posted by iamblum
As we all know these beasts are worse than the kids or the DW and need lots of attention. Seems like it's always asking me to bring it home for the weekend to ""give"" it some tlc. So I replaced the flush valve on the thereford Aqua magic IV, replaced the Kwikee step controller, 3 12 volt house batteries, circuit board for the Atwood water heater
and next is replacing the slide topper material. Still need to research a bit more before doing that 1. What have you don't lately?
DH replaced the old Magnetek 6345 converter/charger with a new WFCO 9845 model, then continued tearing out the old carpet. I'm just the cleanup crew so I carried the old carpet out front and tossed it over the fence and then into the trash can! Happy to say that the house batteries are showing a full charge (sans battery charger) for the first time, and the converter/charger fan actually turns on and off. Second coat of Dicor applied over new roof membrane - looks great! Delam repair on tap but not until the floor is done and we sort out whether to put together our own kit or buy one from delamrepair.com. I want to go camping soon (before winter)!",Electrical,,,,,,,,,,,,,,,,,,,,,,,,,,,,,,,,,,,,,,,,,,,,,,,,,,,,,,,,,,,,,,,,,
